abstract,author,citation_key,doi,entry_type,issn,journal,keywords,note,number,pages,title,url,volume,year
"Background Mammographic screening performance declines in women with dense breasts, leading to diagnostic inequities and delayed cancer detection. Thermal imaging captures complementary functional cues such as vascular and metabolic activity that remain detectable irrespective of density with the help of Artificial Intelligence (AI). This study presents an adaptive Density-Informed Multimodal AI (DIMA) Framework that integrates mammography and thermal imaging to improve breast cancer detection performance across breast density categories. Methods The framework integrates two complementary AI pipelines: a multi-view deep learning model trained on 19,883 mammograms for morphological feature analysis, and a radiomics-based Thermalytix system trained on over 100,000 thermal images to capture vascular and thermal asymmetries. Breast density, categorized by ACR grades, functions as a conditional variable that dynamically determines which model’s prediction is used. The mammography AI is applied for fatty breasts (ACR A and B), whereas the Thermalytix AI is prioritized for dense breasts (ACR C and D). This density-conditioned decision logic enables optimal modality utilization while maintaining interpretability. To assess real-world applicability, the framework was evaluated on 324 women who underwent both mammography and thermal imaging. Results The DIMA framework achieved a sensitivity of 94.6% (95% CI: 88.6–100) and specificity of 79.9% (95% CI: 75.1–84.7), outperforming standalone mammography AI (sensitivity 81.8%, specificity 86.3%) and Thermalytix AI (sensitivity 92.7%, specificity 75.5%). Importantly, the sensitivity of Mammography dropped significantly in dense breasts (67.9%) versus fatty breasts (96.3%), whereas Thermalytix AI maintained high and consistent sensitivity in both (92.6% and 92.9%, respectively). Conclusions This retrospective cross-sectional diagnostic accuracy evaluation demonstrates the potential of a DIMA routing strategy to improve breast cancer detection across breast density categories. Population-based screening studies are required to assess its generalizability, equity, and role within large-scale screening programs.",Siva Teja Kakileti and Bharath Govindaraju and Sudhakar Sampangi and Geetha Manjunath,KAKILETI2026100053,https://doi.org/10.1016/j.ibreh.2026.100053,article,2950-2128,Innovative Practice in Breast Health,"Breast Cancer, Mammography, Thermalytix, Thermal Imaging, Multi-modal imaging, Artificial Intelligence, Machine Learning",,,100053,Adaptive Density-Informed AI Framework for Improving Breast Cancer Detection Using Mammography and Thermal Imaging,https://www.sciencedirect.com/science/article/pii/S2950212826000047,,2026
"Crop nutrition deficiency poses a major challenge to achieving optimal yield, particularly in smallholder farming systems where timely expert diagnosis is limited. Early detection is crucial to minimize losses and reduce unnecessary fertilizer or pesticide usage. While deep learning offers potential for automated visual diagnosis, most existing approaches operate as black boxes and lack interpretability, explainability, or actionable recommendations. In this work, we present a neurosymbolic framework for early nutrient deficiency detection in ash gourd leaves using the EarlyNSD dataset. Our approach integrates a ResNet-50 backbone with a dual-head design: a classification head for deficiency prediction and a concept-prediction head that quantifies physiologically meaningful visual patterns such as yellowing, edge discoloration, spots, and vein greenness. These concept scores are combined with predefined domain rules to guide the learning of the neural component and to generate transparent, human-aligned explanations for each diagnosis. Building on the model outputs, we incorporate a Retrieval Augmented Generation (RAG)-based pipeline along with an agricultural knowledge base to generate targeted recommendations. This approach overcomes key shortcomings of pure neural models by incorporating domain knowledge in the form of differentiable fuzzy logic rules. The study demonstrates that the proposed framework improves both classification performance and interpretability compared to standard ResNet baselines. Grad-CAM analysis demonstrates that concept-guided attention aligns with symptom-specific regions, such as yellowed areas for Nitrogen deficiency or marginal discoloration for Potassium deficiency, providing visual validation of the reasoning process. Since EarlyNSD is limited in scale and visual diversity, the results are not directly comparable to large open-field datasets. Overall, our results establish a proof of concept for integrating neural detection with symbolic reasoning, enabling interpretable, actionable, and domain-informed nutrient management for practical applications.",Semanto Mondal and Antonino Ferraro and Fabiano Pecorelli and Martina Iammarino and Giuseppe De Pietro,MONDAL2026111735,https://doi.org/10.1016/j.compag.2026.111735,article,0168-1699,Computers and Electronics in Agriculture,"Neurosymbolic, ResNet, RAG, Early crop nutrition deficiency, Fuzzy logic",,,111735,Concept and rule guided neural network for early crop leaf nutrient deficiency diagnosis,https://www.sciencedirect.com/science/article/pii/S0168169926003303,248,2026
"Glaucoma, the leading cause of irreversible blindness, requires early and accurate detection for effective treatment planning. Existing automated systems encounter several limitations, including insufficient accuracy in detecting subtle glaucoma-related changes, computational inefficiency, reliance on full-fundus views, class imbalance, and lack of interpretability, hindering their clinical application. This study proposes an enhanced SqueezeNet architecture for glaucoma detection (GD) that incorporates grouped convolutions, simplified fire modules, and transformer encoders to improve feature extraction and long-range dependency modeling. A novel multi-scale adaptive template matching method is introduced for precise optic disc (OD) localization, eliminating irrelevant background information. Class imbalance is addressed using a hybrid SMOTE-TOMEK strategy to enhance the model sensitivity. Model interpretability is improved through saliency maps, promoting confidence in clinical application. The architecture is computationally efficient, with only 0.8 million parameters, ensuring practicality for large-scale deployment. It achieved an accuracy of 99.52 % on REFUGE, 99.15 % on ACRIMA, and 94.23 % on RIM-ONEv2, demonstrating robustness across diverse datasets. Compared with 13 well-known convolutional neural network (CNN) models, the enhanced architecture outperformed most of them across multiple metrics. With improved accuracy, efficiency, and OD-focused interpretability, this method enables practical, large-scale glaucoma screening for clinical and telemedicine use.",Mohamed Mouhafid and Yatong Zhou and Chunyan Shan and Zhitao Xiao,MOUHAFID202548,https://doi.org/10.1016/j.aej.2025.10.007,article,1110-0168,Alexandria Engineering Journal,"Deep Learning, Glaucoma Diagnosis, Medical Imaging, CNN",,,48-89,Boosted diagnostic accuracy in glaucoma detection with SqueezeNet-TR lite architecture and precise optic disc localization,https://www.sciencedirect.com/science/article/pii/S1110016825010518,131,2025
"Integrating smart farming technologies in agriculture is crucial to address the pressing challenges of food security, economic stability, and environmental sustainability. Solutions based on artificial intelligence (AI) for plant disease detection play a critical role in optimizing crop health and yield. However, the complexity and opacity of these AI models can hinder their acceptance and practical application by end-users. To address this issue, our ongoing research explores applying explainable AI (XAI) techniques to enhance the explainability of vision-based plant disease classification models. Our experiments assess the transparency of vision-based models by applying XAI techniques, such as LIME, Grad-CAM, and occlusion-based attribution, to visualize the reasoning behind model predictions. Additionally, we analyze inherently transparent machine learning models, such as k-Nearest Neighbors, through custom visualization graphics and examine how explainability varies with model accuracy. These findings highlight the role of XAI techniques in enhancing the transparency of predictions for crucial vision tasks in agriculture such as plant disease classification. Building on these results, we explore the potential integration of X AI techniques into third-party applications or prototypes, emphasizing how tailored visual and textual explanations can enhance the transparency and interpretability of plant disease classification models.",Rui Pedro Porfírio and Rui Neves Madeira and Pedro Albuquerque Santos,PORFIRIO2025175,https://doi.org/10.1016/j.procs.2025.07.170,article,1877-0509,Procedia Computer Science,"Plant Disease Detection, Digital Agriculture, Explainable AI, Machine Learning, Computer Vision",20th International Conference on Future Networks and Communications/ 22nd International Conference on Mobile Systems and Pervasive Computing/15th International Conference on Sustainable Energy Information Technology (FNC/MobiSPC/SEIT 2025),,175-182,Exploring Explainable AI Techniques for Plant Disease Classification in Digital Agriculture,https://www.sciencedirect.com/science/article/pii/S1877050925022203,265,2025
"Photovoltaics (PV) are among the primary renewable and clean energy sources deployed globally, requiring frequent and efficient inspections to maintain optimal performance. Inspections conducted with unmanned aerial vehicles (UAVs) are optimized for large-scale installations, but they generate large datasets that are time-consuming to label manually. This study introduces a novel automatic geo-labeling approach of raw Infrared (IR) UAV imagery. It includes adaptive thresholding and edge refinement with photogrammetric data to automatically detect and geo-localize individual solar modules, without the need for manual annotation. The resulting auto-labeled images are then used to train and compare Deep Learning detectors for module-level segmentation. Among the tested models, Yolov7 demonstrated the best performance, achieving a mean Average Precision (mAP) of 98.33 %, with an inference time of only 15 ms, proving its suitability for real-time applications and integration within the inspection process. The dataset used for training includes UAV-based IR imagery from both ground-mounted and roof-mounted photovoltaic systems. The proposed approach accelerates the data preparation process and enables accurate on-site module localization, making it highly practical for automated PV inspection pipelines.",Zoubir Barraz and Imane Sebari and Nassim Lamrini and Kenza {Ait El Kadi} and Ibtihal {Ait Abdelmoula},BARRAZ2025101048,https://doi.org/10.1016/j.clet.2025.101048,article,2666-7908,Cleaner Engineering and Technology,"Automatic geo-labeling, Computer vision, Deep learning, Photogrammetric data, Solar modules segmentation, UAV thermal large-scale photovoltaic datasets",,,101048,Fast and automatic solar module geo-labeling for optimized large-scale photovoltaic systems inspection from UAV thermal imagery using deep learning segmentation,https://www.sciencedirect.com/science/article/pii/S2666790825001715,28,2025
"Timely and accurate identification of plant leaf diseases plays a vital role in ensuring sustainable agriculture and universal food security. Accurate identification of plant leaf diseases ensures healthier plant cultivation, which is pivotal for sustainable agriculture operations. In this study, we present a plant leaf disease recognition mechanism that utilizes a stacking ensemble structure combined with a Large Language Model (LLM) and Explainable AI (XAI) mechanism to improve identification accuracy and comprehensibility. To capture high textural structure, we utilized the Gray Level Co-occurrence Matrix (GLCM), whereas the MobileNetV3 architecture was utilized to maintain low computational cost in feature extraction. GoogleNet was integrated to improve multi-scale feature extraction by employing inception blocks, which effectively obtain fine-grained details and universal spatial patterns. Our ensemble framework integrates improved versions of MobileNetV3, GoogleNet, and ConvNeXtSmall with CatBoost employed as a nonlinear meta-learner allowing the framework to effectively capture complex connections among the base models within the ensemble framework. Moreover, we utilized additional CNN models, including AlexNet and EfficientNetV2B0, to compare the result of our proposed stacking ensemble model and to evaluate its generalization ability over various architectural designs. In addition, we developed a real-time system integrating an LLM with the proposed ensemble model, ensuring automatic plant leaf disease recognition and delivering corresponding curing recommendations. Our findings contribute to plant-based agriculture by enabling early diagnosis of leaf diseases and providing real-time recommendations through DL and LLM technology.",Dip Kumar Saha and Mohammad Rasel Ahmed and Tushar Deb Nath and Rounakul Islam Boby and Md. Jakir Hossen and M.F. Mridha,SAHA2025200596,https://doi.org/10.1016/j.iswa.2025.200596,article,2667-3053,Intelligent Systems with Applications,"Plant leaf, Identification, Deep learning, LLM, XAI",,,200596,Fusing explainable deep learning ensembles and LLM recommendations for real-time plant leaf disease diagnosis,https://www.sciencedirect.com/science/article/pii/S266730532500122X,28,2025
"Accurate crop damage classification is crucial for timely interventions, loss reduction, and resource optimization in agriculture. However, datasets and models for binary classification of damaged versus non-damaged crops remain scarce. To address this, we conducted an extensive study on crop damage classification using deep learning, focusing on the challenges posed by imbalanced datasets common in agriculture. We began by preprocessing the “Consultative Group for International Agricultural Research (CGIAR)” dataset to enhance data quality and balance class distributions. We created the new “Crop Damage Classification (CDC)” dataset tailored for binary classification of “Damaged” versus “Non-damaged” crops, serving as an effective training medium for deep learning models. Using the CDC dataset, we benchmarked the state-of-the-art models to evaluate their effectiveness in classifying crop damage. Leveraging the depth channel shuffling technique of ShuffleNetV2, we proposed a lightweight model “Light Crop Damage Classifier (LightCDC)”, reducing the parameters from 1.40 million to 1.13 million while achieving an accuracy of 89.44%. LightCDC outperformed existing classification and ensemble models in terms of model size, parameter count, inference time, and accuracy. Furthermore, we tested LightCDC under adverse conditions like blur, low light, and fog, validating its robustness for real-world scenarios. Thus, our contributions include a refined dataset and an efficient model tailored for crop damage classification, which is essential for timely interventions and improved crop management in resource-constrained precision agriculture. To ensure reproducibility, we released the code and dataset on GitHub.",Md Tanvir Islam and Safkat Shahrier Swapnil and Md. Masum Billal and Asif Karim and Niusha Shafiabady and Md. Mehedi Hassan,ISLAM2025110117,https://doi.org/10.1016/j.engappai.2025.110117,article,0952-1976,Engineering Applications of Artificial Intelligence,"Crop damage classification, Resource constraint agriculture, Precision agriculture, Crop management, Crop monitoring, Deep learning, LightCDC",,,110117,Resource constraint crop damage classification using depth channel shuffling,https://www.sciencedirect.com/science/article/pii/S0952197625001174,144,2025
"Histopathology image analysis faces challenges due to magnification variability, limiting robust tumor categorization. Existing deep learning models prioritize accuracy but neglect explainability, ethical biases, and real-world deployment. This study proposes xMagNet, a hybrid Transformer-Convolutional Neural Network (CNN) framework that synergizes technical rigor, clinical transparency, and ethical fairness for multi-magnification breast cancer diagnostics. xMagNet integrates a hybrid encoder combining Vision Transformers (ViT) for global tissue modeling at low magnifications (4x–10x) and Separable Dilation Convolutions (SDC) for localized nuclear texture extraction at high magnifications (20x–40x). Magnification-Aware Gating (MAG) dynamically balances ViT and SDC features via temperature-scaled sigmoid activation. A multi-task decoder employs Thresholded Grad-CAM (top 10% gradients) for explainable decision-making and Point-wise Reformation Blocks (PRB) for boundary preservation. Federated learning (FL) with momentum-enhanced aggregation and Sinkhorn divergence regularization ensures scanner/stain-invariant training across six institutions (Hamamatsu/Leica, H&E/IHC). Uncertainty-quantified predictions (Monte Carlo dropout) and adversarial debiasing mitigate demographic leakage. xMagNet achieves a 97.8% F1-score for tumor segmentation on Camelyon16 and a 93% Gleason AUC on PANDA, with 96.5% pathologist concordance via Grad-CAM. At 40x magnification, it detects micro-metastases with 94% sensitivity (vs. UNet++’s 89% and ResUNet’s 91%). Computational efficiency includes sub-second inference (0.42 sec/slide) and 2.3x faster convergence than HoVer-Net. Ethical auditing reveals <3% fairness gaps (ΔCFG) and a 73% domain shift reduction (MMD: 0.12 vs. FedAvg’s 0.45), validated on 15,000 whole-slide images (WSIs) from TCGA-BRCA, Camelyon16, and PANDA datasets. xMagNet bridges critical gaps in multi-magnification histopathology by harmonizing technical robustness (MAG fusion, bounded gradients) with clinical utility (HER2+/ER+ subtyping, Gleason grading) and ethical scalability. By achieving high accuracy, rapid inference, and equitable deployment, it advances AI-driven diagnostics toward trustworthy, deployable systems for breast, prostate, and metastatic cancer imaging. Code available at: xMagNet.",Saeed Iqbal and Muhammad Attique Khan and Leila Jamel and Adnan N. Qureshi and Imran Arshad Choudhry and Amir Hussain,IQBAL2026132745,https://doi.org/10.1016/j.neucom.2026.132745,article,0925-2312,Neurocomputing,"Breast cancer histopathology, eXplainable AI (XAI), Multi-magnification analysis, Vision transformers, Federated learning, Uncertainty quantification",,,132745,xMagNet: Dynamic magnification-aware fusion with uncertainty quantification for robust breast cancer histopathology,https://www.sciencedirect.com/science/article/pii/S0925231226001426,673,2026
"Animal welfare monitoring is a key part of veterinary surveillance in every poultry slaughterhouse. Among the animal welfare indicators routinely inspected, the prevalence of wing fractures and soft tissues injuries (e.g. bruises) is particularly relevant, because it is related to acute pain and suffering in injured birds. According to current practice, assessment corresponds to visual examination by animal welfare officers. However, taking into consideration the speed of the production line and limitations associated with human inspection (e.g. different visual perception, subjectivism and fatigue), new more objective and automated techniques are desirable. Therefore, the aim of this study was to assess the applicability of three deep learning classification models to detect fractures and/or bruises based on computed tomography (CT) scans and photographs of the wings. Namely, 1. Model_CT (two categories: 1.BROKEN and 2.NON_BROKEN) detecting fractures based on CT scans, 2.Model_Photo_Fractures (1.FRACTURES and 2.NO_FRACTURES) detecting fractures based on photographs and 3.Model_Photo_Bruises (1.BRUISES and 2.NO_BRUISES) detecting bruises based on photographs. To train, validate and test these models 306 CT scans and 285 photographs were collected. The 3D ResNet34 and 2D EfficientNetV2_s architectures were used for the CT and Photo_Models, respectively. The models reached an accuracy of 98 % (Model_CT), 96 % (Model_Photo_Fractures) and 82 % (Model_Photo_Bruises). All in all, applying deep learning to the combination of CT scanning and photography can help to objectively recognize wing fractures and bruises. Consequently, it might lead to more accurate and objective animal welfare monitoring and ultimately to raised animal welfare standards.",Kacper Libera and Dirk Schut and Effrosyni Kritsi and Louis {van Steijn} and Timothy Dallman and Len Lipman,LIBERA2025105264,https://doi.org/10.1016/j.psj.2025.105264,article,0032-5791,Poultry Science,"Food inspection, Animal welfare monitoring, X-ray inspection, Artificial intelligence, CT",,8,105264,"Detecting wing fractures in chickens using deep learning, photographs and computed tomography scanning",https://www.sciencedirect.com/science/article/pii/S0032579125005061,104,2025
"Oyster mushroom cultivation is gaining popularity in Nepal because of its high nutritional value, low investment requirements, and favorable climatic conditions. However, frequent disease outbreaks significantly impact yield and farmer income. This study presents OysterMushNet, an end-to-end mobile application tailored for real-time disease classification, remedy recommendations, and agronomist support. A self-collected dataset of 8884 images from multiple farms was used to train and validate an ensemble deep-learning model that combined EfficientNetB0, DenseNet201, and ResNet50V2. The ensemble model achieved 98.8 % accuracy and a mean F1-score of 0.98, outperforming individual models. To enhance real-world usability, the model was optimized for mobile device deployment using quantization techniques. This technique significantly reduces the model memory footprint as well as the inference time. The application features bilingual support (English/Nepali) and real-time farmer-agronomist communication. Field testing with 50 farmers and 10 agronomists over six months demonstrated the application's high usability, with 94 % of users finding bi-directional communication essential and 90 % validating remedy recommendations. Additionally, farmers reported a 20–30 % reduction in crop loss due to early disease detection and expert intervention. These findings highlight the potential of OysterMushNet as a scalable AI-driven solution for precision agriculture in regions with limited access to agronomists. Future works aim to expand the dataset, improve model interpretability, and integrate additional features, such as market price tracking and video upload, to enhance the application's usability and overall impact.",Deepesh Prakash Guragain and Bijaya Shrestha and Iswor Bajracharya and Neelesh Sharma and Dipesh Ghimire and Showkat Ahmad Bhat,GURAGAIN2026101735,https://doi.org/10.1016/j.atech.2025.101735,article,2772-3755,Smart Agricultural Technology,"Oyster mushroom, Deep-learning, Ensemble model, Mobile application, Precision agriculture, Transfer learning",,,101735,OysterMushNet: A deep learning-based mobile application for real-time mushroom disease detection and agronomist support,https://www.sciencedirect.com/science/article/pii/S2772375525009669,13,2026
"Accurate and timely classification of rice paddy ripeness is critical for optimizing harvest decisions, improving grain quality, and strengthening global food security. Traditional manual assessments remain subjective, labor-intensive, and poorly scalable, underscoring the need for automated solutions. This study presents a rigorous comparative evaluation of five fine-tuned deep learning architectures for real-time rice maturity assessment: YOLOv11 enhanced with an Attention-Guided Multi-Scale Feature Fusion (AGMS-FF) module, baseline YOLOv11, ResNet18, EfficientNet-B0, and MobileNetV3. Two publicly available datasets were utilized: one augmented to simulate diverse field conditions and another comprising raw, uncontrolled imagery to assess real-world generalizability. To ensure robustness and mitigate overfitting, we employed 5-fold cross-validation alongside a held-out test evaluation. Models were assessed across Accuracy, Precision, Recall, F1-score, ROC-AUC, and PR-AUC metrics. The AGMS-FF YOLOv11 achieved superior performance, with up to 99.6 % cross-validation accuracy (±0.21), ROC-AUC = 0.9877 and PR-AUC = 0.9526 on the augmented dataset, and 98.0 % test accuracy with perfect ROC-AUC and PR-AUC (1.000) on the raw dataset. Statistical validation confirmed the significance of these results through ANOVA (Dataset 1: F(4,20) = 158.4, p < 0.001; Dataset 2: F(4,20) = 92.7, p < 0.001) and McNemar’s paired tests (p < 0.05). These findings provide robust comparative benchmarks across lightweight and state-of-the-art models, reinforcing the viability of deep learning-based computer vision systems for sustainable rice farming and their potential for scalable field deployment.",Entesar Hamed I. Eliwa and Tarek {Abd El-Hafeez},ELIWA2025100785,https://doi.org/10.1016/j.eij.2025.100785,article,1110-8665,Egyptian Informatics Journal,"Rice classification, Deep learning, Lightweight models, Agricultural automation, Computer vision",,,100785,Deep learning for sustainable agriculture: automating rice and paddy ripeness classification for enhanced food security,https://www.sciencedirect.com/science/article/pii/S1110866525001781,32,2025
